ID,URL,Title,Context,Index
72777851,https://en.wikipedia.org/wiki?curid=72777851,Bradley Goodyear,"partner Donovan, who was then also the U.S. Attorney for the Western District of New York, had his agents raid Buffalo's private Saturn Club (of which both men were members and which Goodyear was a Dean of) and confiscated large amounts of illegal liquor.
Military service.
During the War, Goodyear went overseas with the 106th Field Artillery, with whom he had earlier served in the Mexican Border campaign. During the War, he fought in France during the Battle of Verdun and by the Wars end, had advanced to the rank of Major and was the commanding officer of his regiment.
Personal life.
In 1910, Goodyear was married to Jeanette Bissell (1886–1983), a daughter of Arthur D. Bissell and Frances ""Fanny"" ( Castle) Bissell. The Goodyears lived on Bryant Street and, later, on",228027
74356448,https://en.wikipedia.org/wiki?curid=74356448,World Jenny's Day,"World Jenny's Day is an awareness day that takes place every year on 10 October, since 2020. It was founded by Jenetta Barry, who lost her sixteen-year-old daughter, Jenny, to suicide. The day was chosen as Jenny died on World Mental Health Day
Whilst bringing awareness to teen suicide - and suicide in general - World Jenny's Day specifically addresses the de-stigmatisation of conversation around suicide, and to normalise conversations between people around mental health and suicide prevention.
WJD makes use of the arts and performing arts as a way to convey their messaging, which happens throughout the year, with festivities culminating on the 10th of October.
Endorsements.
Through its various fundraising initiatives and its campaigns, WJD is actively endorsed by UK Prime Minister Rishi Sunak as well as British Gold paralympian",475164
72140684,https://en.wikipedia.org/wiki?curid=72140684,Yacov Bengo,"armored Division until the 18th of march 2018. later in the same year he became the Head of the IDF Doctrine and Training Division (J7).
In September 2019 he was promoted to the rank of Aluf and appointed as the head of the northern command, while still simultaneously serving as the head of the Doctrine and Instructions division. Then in August 2020 he was also appointed as the commander for the multidimensional maneuvering command in the Ground Forces.
In 2019 Bengo co-Published a book called ""Operational Focus: an Approach to Describe, Plan, and Manage in Contemporary Military Operations"" with Matania Tzachi, which presents a force application and build-up model in the strategic level. The book followed a series of articles he penned a couple years earlier.
In January 2022 Bengo was",117690
72954908,https://en.wikipedia.org/wiki?curid=72954908,Dutch Catholic Metal Workers' Union,"The Dutch Catholic Metal Workers' Union (), known as ""Sint Eloy"", was a trade union representing metalworkers in the Netherlands.
The union was founded on 20 April 1902. By 1964, it had 50,942 members. The union eventually broadened its remit to cover the electronics industry, and renamed itself as the Dutch Catholic Union of Employees in Metal, Electronics and Related Companies.
For most of its existence, the union was affiliated to the Dutch Catholic Trade Union Federation (NKV). On 1 January 1972, it merged with the Dutch Catholic Clothing and Textile Workers' Union, the Dutch Catholic Mineworkers' Union, and the Dutch Catholic Factory Workers' Union, to form the Industrial Workers' Union NKV.",255715
73762052,https://en.wikipedia.org/wiki?curid=73762052,List of monarchs of Magadha,"The Kingdom of Magadha, later known as the Magadha Empire, was a kingdom and later empire in ancient north India. Many houses ruled the kingdom and it's empire over the centuries until it was defeated by the Satavahana Empire in . The history of the monarchs of Magadha, particularly in the Pre-Mauryan period, is shrouded in mystery and legend with various sources claiming different things.
Kingdom of Magadha.
House of Brihadratha.
The Brihadratha dynasty was the first ruling house of Magadha. Brihadratha founded this dynasty in 1700 BCE. This dynasty lasted for more than ten centuries, ruling Magadha from 1700 to 682 BCE.
List of monarchs.
Twenty-one kings of Brihadratha house ruled Magadha beginning with Brihadratha himself.
Pre-Mauryan Era.
House of Haryanka.
The Haryanka dynasty was the third ruling house of Magadha. This dynasty was founded",386438
72123356,https://en.wikipedia.org/wiki?curid=72123356,2022–23 Iraq Division One,"Baghdad on May 26, 2023 to determine the league champion. The Al-Minaa administration demanded that the match be transferred to Basra due to the large number of fans of the Al-Minaa, so that the match would be more attended, and the Amanat Baghdad administration agreed to that. Later, the Football Association decided that the match would be held on 2 June in Al-Fayhaa Stadium.
In the final, Al-Minaa was able to defeat Amanat Baghdad, 2–1, and win the title. The goals of Al-Minaa were scored by Sajjad Alaa (6') and Salem Ahmed (37'), while the goal of Amanat Baghdad was scored by Karrar Ali Bari (53').
Al-Jinsiya (who withdrew from the start) and Al-Hawija from Group 1, and Al-Sulaikh and Al-Samawa from Group 2 were relegated to the Iraq Division",115229
72909893,https://en.wikipedia.org/wiki?curid=72909893,Nikolai Pegov,"Nikolai Pegov (Russian: Николай Пегов; 3 April 1905 – 19 April 1991) was a Soviet official and diplomat. He served as the ambassador to Iran, Algeria, and India. Being a member of the Communist Party he also held various posts at the party.
Early years and education.
Pegov was born in Moscow on 3 April 1905. His father was a clerk. Pegov began to work in 1919 and joined the Communist Party in 1930. He worked at different factories until 1935 when he enrolled at the Moscow Industrial Academy. He graduated from the academy in 1938.
Career.
Following his graduation Pegov began his party career and became the secretary of the Far Eastern Regional Committee of the All-Union Communist Party of Bolsheviks. In October 1938 he was appointed first secretary of the",248861
72337187,https://en.wikipedia.org/wiki?curid=72337187,Ben Bell,"over a bullying culture."" On 16 May, the seven councillors abandoned their attempts to hold a vote of no confidence in Bell's leadership. Instead, Hovell successfully tabled an amended motion calling for the Gore District Council to work with Local Government New Zealand (LGNZ) to develop terms of reference for an independent review to restore confidence in the Council.
On 13 June 2023, Bell submitted a petition calling for the resignation of CEO Parry. The petition was rejected by his fellow councillors, with Bell being the sole supporter. According to the ""Otago Daily Times"", the 4,800-strong petition was dominated by non-Gore residents, with Gore residents only accounting for 9% of signatures. On 21 June, Bell and his fellow councillors apologised to Parry. 
On 11 July, Bell apologised to the",153807
72102661,https://en.wikipedia.org/wiki?curid=72102661,Morag Park,"Morag Park is a breast cancer and genomics researcher at the McGill University Health Centre. Park is known for her work on the combination of genetic and epigenetic alterations that result in breast cancer progression and receptor tyrosine kinases involved in cancer. More recently, she has worked in as primary co-researcher of a Quebec cancer biobank network that creates tumor models derived from patients, allowing for research into why individual patients respond well or poorly to cancer therapies. She is currently a professor in the Gerald Bronfman Department of Oncology and a member of the Faculty of Medicine and Health Sciences at McGill University.
Education.
Park conducted her undergraduate studies at University of Glasgow and received a B.Sc. with first class honors. She received a PhD in viral carcinogenesis at",111765
74299896,https://en.wikipedia.org/wiki?curid=74299896,Cornelius Boyle,"a ""Captain"" and ordered to bring the men to Culpeper, Virginia where they arrived April 28. By May 6 Boyle had been granted a commission of Major, a rank he then held throughout the war. Initially under the command of Beauregard, Boyle was operating from a ""small white cottage"" next to the medical office in Camp Pickens near Manassas, where Lt. Col. George W. Lay wrote of Boyle's ""peculiar duties at Manassas"".
In 1862, Gen. Robert E. Lee ordered Boyle to take command as Provost Marshal of the position at Gordonsville, Virginia where he would remain. Boyle was believed to have quickly fallen into espionage, given the railroad's passage through Gordonsville enabling messages in and out of DC, and his connections with people such as Rose O'Neal Greenhow. Boyle",466513
72476198,https://en.wikipedia.org/wiki?curid=72476198,Amanda (2022 film),"Amanda is a 2022 Italian comedy-drama film written and directed by Carolina Cavalli.
The film premiered in the Horizons Extra section of the 79th Venice Film Festival, and was later screened at the 2022 Toronto International Film Festival. It was released in Italy on 13 October 2022.
Reception.
On the review aggregator website Rotten Tomatoes, the film holds an approval rating of 95% based on 43 reviews, with an average rating of 7.3/10. The website's critics consensus reads, ""A is for ""Amanda"", an amusingly absurd coming-of-age comedy that offers poignant observations and positions director Carolina Cavalli as a talent to watch."" On Metacritic, the film has a weighted average score of 81 out of 100 based on 10 critics, indicating ""universal acclaim"".
Peter Bradshaw of ""The Guardian"" described it as ""a film",175793
71697027,https://en.wikipedia.org/wiki?curid=71697027,Gale Turnbull,"Daniel Gale Turnbull Jr., was an American ceramicist, painter, etcher, and art director active from the 1920s until the 1950s. He is best known for his work as art director and designer at Vernon Kilns beginning in 1936.
Personal life.
Gale Turnbull was born on December 19, 1886. He attended Pratt Institute and the College of New York but left without graduating and moved to France in 1912.
On June 2, 1917, Turnbull joined the American Field Service, indicating on the enlistment form that he was working as an artist at the time. He served as an ambulance driver with the French army for 3 months before leaving to become a sergeant in the United States Army until the end of the war.
Daniel Gale Turnbull died on March 11, 1964, in",45779
73123724,https://en.wikipedia.org/wiki?curid=73123724,Uzbekistan cough syrup scandal,"were still engaged in selling such drugs. That month, 3 imported batches of the Dok-1 Max (about 60,000 boxes) were placed under strict control by officials of the State Customs Committee against in response to the health crisis.
Ministry of Health
In connection with the incident, officials of the Ministry of Health of Uzbekistan reported that they formed a special working group consisting of qualified specialists of the State Center for Expertise and Standardization of Medicines, Medical Products and Medical Equipment in order to study the negative symptoms caused by the adulterated drug. The message stated that there was a criminal motivation behind the incident, that 7 persons responsible were fired, and that the identified information was sent to the law enforcement authorities. According to the report, the medicine was",282206
72199794,https://en.wikipedia.org/wiki?curid=72199794,Foundation for Aboriginal Affairs,"conducted throughout Sydney. Chicka Dixon and Harry Williams were among those involved in running the services, and there were also non-Aboriginal people who helped with fund-raising events and other activities. In September 1964, when Rev. J. Downing was head of the social work committee, the foundation started a recruitment drive for a full-time Aboriginal social worker, the first such position in the country.
The Foundation provided legal, financial and practical help, in matters such as housing, education for employment, and medical assistance. It had a ""self-help"" approach, and helped to motivate Aboriginal people to take control of their lives, but also to participate in white Australian society. It also supported local Aboriginal musicians such as Malcolm ""Mac"" Silva (1947-1989) and his band Black Lace, formerly Silver Linings Jimmy Little,",129648
73181599,https://en.wikipedia.org/wiki?curid=73181599,Olga Ilyinichna Ulyanova,"a certificate of reliability and, in the fall of that year, was admitted to the Bestuzhev Courses in St. Petersburg. She studied physics, mathematics, English, German, French, Swedish, Latin, Italian, and drawing while enrolled at Bestuzhev. She had hopes of studying medicine.
Death.
After studying in St. Petersburg for six months, Ulyanova contracted typhoid fever and died at the Alexander Hospital on 8 May 1891, at the age of 19. She was buried in Volkovo Cemetery.",290368
73167867,https://en.wikipedia.org/wiki?curid=73167867,Francis Lopez (basketball),"Metro Manila, where they just missed the medal rounds.
La Salle Green Hills.
LSGH assistant coach and scout Anton Brodett recruited Lopez to play for La Salle Green Hills (LSGH) after seeing him play in a neighborhood basketball court in Las Piñas. However, he averaged 2.3 points and 1.3 rebounds in 3.4 minutes, seeing action in only 10 of their 22 games in all. He was also set to play in the NCAA Season 94 Shooting Stars competition, but didn't get to compete and was replaced by Sebastian Locsin. LSGH went on to finish as runner-ups to Mapúa for Season 94.
Ateneo de Manila.
After Season 94, LSGH underwent changes in management. That, and talks with Ateneo assistant coach Ford Arao, prompted Lopez to transfer to Ateneo de Manila.
Lopez debuted in Season",288580
72726996,https://en.wikipedia.org/wiki?curid=72726996,Billy Nolen,"Billy Nolen is an American government official who served as acting administrator of the Federal Aviation Administration (FAA) from April 1, 2022 to June 2023.
Prior to Nolen's appointment as acting administrator, he worked with American Airlines, Airlines for America, Qantas Group, and WestJet in safety positions. He left WestJet in January 2022 to join the FAA and served as the associate administrator for aviation safety of the FAA, before resigning in April to become acting administrator. In June 2023 he stepped down and was replaced by Polly Trottenberg.
Career.
Nolen first worked as a pilot for American Airlines in 1989 where he flew as a pilot and was type rated in the Boeing 757, Boeing 767, and McDonnell Douglas MD-80 aircraft. He joined Airlines for America on July 1, 2015,",219797
74296973,https://en.wikipedia.org/wiki?curid=74296973,Criticisms of Qatar's suitability to host the 2022 FIFA World Cup,"one.
Move to November and December.
Owing to the climate in Qatar, concerns were expressed over holding the World Cup in its traditional time frame of June and July. In October 2013, a task force was commissioned to consider alternative dates and report after the 2014 FIFA World Cup in Brazil. On 24 February 2015, the FIFA Task Force proposed that the tournament be played from late November to late December 2022, to avoid the summer heat between May and September and also avoid clashing with the 2022 Winter Olympics in February, the 2022 Winter Paralympics in March and Ramadan in April.
The notion of staging the tournament in November was controversial because it would interfere with the regular season schedules of some domestic leagues around the world. Commentators noted the",466302
71892132,https://en.wikipedia.org/wiki?curid=71892132,Zach Eckersley,"Zach Eckersley (born 10 November 2003) is a professional rugby league footballer who plays as a for Barrow Raiders in the RFL Championship, on 1-month loan from the Wigan Warriors in the Betfred Super League.
Playing Career.
Wigan Warriors.
In 2022 Eckersley made his Super League début for Wigan against Hull Kingston Rovers.
London Broncos (loan).
On 10 Feb 2023 it was announced he would join the London Broncos on an initial one month loan.
Widnes Vikings (loan).
On 4 Apr 2023 it was announced he would join the Widnes Vikings on short-term loan.
Barrow Raiders (loan).
On 7 Jul 2023 it was announced he would join the Barrow Raiders on short-term loan.",78306
74643382,https://en.wikipedia.org/wiki?curid=74643382,Horse pain caused by the bit,"also conclude that the absence of blood outside the mouth does not exclude the existence of serious injuries inside. Injuries are often observed in horse racing, whether pre-existing, acquired or aggravated by such racing, probably due to the very nature of these competitions: harnessed horses are controlled exclusively with reins and bits, with great potential tension being exerted via these reins. 
A study carried out by the Finnish team on horses and ponies after a cross-country event in 2021 concluded that injuries were more frequently observed in warm-blooded horses than in ponies. Mares are also at greater risk of lesions than geldings. Of all horses, 52 % (109/208) showed acute oral lesions in the bit area, mild in 22 % (45/208), moderate in 26 % (55/208), and severe",526644
74083116,https://en.wikipedia.org/wiki?curid=74083116,"St. George's Church, Bečej","The St. George's Church () is а Serbian Orthodox church located in the town of Bečej, in Vojvodina, Serbia. It is one of the largest Serbian Orthodox churches in Vojvodina. The building is listed as a cultural monument of great importance. The church was built between 1851 and 1858. Earlier Serbian Orthodox church in the town was destroyed during the Hungarian Revolution of 1848. A major reconstruction of the contemporary church was carried out in 1931 involving expanding the choir, widening the north and south entrances, and constructing new staircases. In October 1944, during the World War II in Yugoslavia, the central tower was damaged, and the restoration of the towers and the roof took place between 1965 and 1966.",440901
73204528,https://en.wikipedia.org/wiki?curid=73204528,In His Good Time,"easily reflect his background. Studded with Kwela and ecclesiastical tropes, he's a jazzman with no recourse to the blues. When he doesn't sound as if he's playing for a footstomping religious service or a simple dance, his tremolo muscularity can be linked to the sounds of Herbie Nichols, McCoy Tyner, or, when he breaks into free time contrasting dynamics, early Cecil Taylor.""
LP track listing.
Track timings not provided.",294093
69428680,https://en.wikipedia.org/wiki?curid=69428680,Untitled Joseph Kosinski film,"the cast in the following months. 
In July 2023, the film began production at the Silverstone Circuit in the United Kingdom, including filming during the 2023 British Grand Prix weekend on July 8–9.
Pitt drove a modified Formula Two car with an added Formula One aero-package during the race weekend, but not in an official F1 session. In an interview with Martin Brundle at the 2023 British Grand Prix, Pitt confirmed that Javier Bardem would be playing the team owner.
It was briefly mentioned during the Sky broadcast of Qualifying for the 2023 British Grand Prix on July 8, 2023 that Condon would be playing former Aston Martin and McLaren strategy engineer Bernadette Collins, although this has yet to be confirmed.
Filming was suspended in July due to the 2023 SAG-AFTRA",8817
73065972,https://en.wikipedia.org/wiki?curid=73065972,Cormocephalus novaehollandiae,"Cormocephalus novaehollandiae is a species of centipede in the Scolopendridae family. It is endemic to Australia, and was first described (as ""Hemicormocephalus novaehollandiae"") in 1908 by German naturalist Karl Kraepelin.
Distribution.
The species is found in the south-west of Western Australia.
Behaviour.
The centipedes are solitary terrestrial predators that inhabit plant litter, soil and rotting wood.
References.
 ",273650
74625672,https://en.wikipedia.org/wiki?curid=74625672,Dhaka to Bombay,"Payel (Sahara) is sold by her Bangladeshi lover to human trafficker Agarwal. Billu rescues Payal from Aggarwal's hideout and they start believing each other. They crossed the border into Bangladesh and went to Badda, Dhaka, from where Billu was trafficked. Billu searches for Tajul everywhere. Suddenly, one day he finds Tajul. Billu's philanthropic work increased his popularity all around city. Tajul plans to kill Billu considering him an election rival.
Meanwhile Billu finds his family. Payal sees Billu with another girl, mistaking him, and goes back to her old boyfriend. Meanwhile Billu finds his family. Seeing Billu with another girl, Payel misunderstands him and goes back to her old boyfriend, who sold her to human trafficker Agarwal. Billu kills everyone while Tajul and his forces escape by ship. Finally",523445
71574895,https://en.wikipedia.org/wiki?curid=71574895,Spotlight (Xiao Zhan song),"for Xiao Zhan to improve his reputation amid the ongoing controversy. This boosted the single's sales, with fans reportedly buying an average of close to 66 copies each. The mass-purchasing campaign was controversial enough that Xiao Zhan's agency posted on Weibo reminding fans to focus on their other priorities in life.
Reception.
On 26 April 2022, it was reported that after the single's release, its rating on Douban reached 7.5 out of 10; it ""received praise from critics in the music industry and got a bumper harvest in both sales and word of mouth"". The single's Douban rating was volatile: it rose to 10 points out of 10, then dropped to 3.2 out of 10, with reviews from 48,000 Douban users. The rating later rose back to 6. At noon",24303
72276235,https://en.wikipedia.org/wiki?curid=72276235,Mitu Khandaker,"Mitu Khandaker is an American game designer and engineer who is founder of The Tiniest Shark and Glow Up Games. She is an Assistant Arts Professor at NYU Tisch School of Arts, specifically within the Game Center. During her time at NYU, she was also the Creative Partnerships Director at Spirit AI, an artificial intelligence London-based company that aims to fight cyberbullying behaviors to foster safer online communities.
Khandaker was featured in the 2021-2022 #IfThen Exhibit which celebrates women innovators in STEM, has been interviewed at GameCity for her work on Redshirt, and has won the Breakthrough BAFTA and Creative English Trailblazer awards.
Education.
Khandaker received her master's degree in computer engineering from the University of Portsmouth, where she also later received her PhD in game design.
Career.
Khandaker was the founder and",144060
72802483,https://en.wikipedia.org/wiki?curid=72802483,Nikol Krasiuk,"Nikol Krasiuk (born 25 January 2004) is a Ukrainian rhythmic gymnast, member of the national group.
Career.
Nikol debuted in 2019 at the Junior World Championships in Moscow, where she ended 16th in teams, 9th with rope, 37th with ball, 5th in the clubs final and 19th with ribbon.
In 2022, after part of the previous team retired after the 2020 Olympics, she was incorporated into the national senior group. After a rough start because of the invasion of Ukraine, they debuted at the World Cup in Pesaro being 11th in the All-Around and 6th with 3 ribbons and 2 balls. In June she competed in Tel Aviv at the European Championships, taking 10th place in the All-Around and 6th with 5 hoops. She also participated in the World Championships in",231931
72178639,https://en.wikipedia.org/wiki?curid=72178639,2012 The Jewish Home leadership election,"was open to the party's nearly 54,000 members to vote in 168 polling stations across the nation.
 
Aftermath.
After his loss, Orlev announced that he would be retiring from the Knesset. Following the primary, the party won 12 seats in the 2013 election, and remained in the coalition.
Bennett led the party until late 2018, when he left to co-found and lead the The New Right. He later became the prime minister of Israel, serving from 2021 through 2022.",125556
72548628,https://en.wikipedia.org/wiki?curid=72548628,Seamus Sharkey,"Seamus Sharkey (born 11 May 1990) is a Manx footballer who plays as a defender for Institute.
Career.
Club career.
Sharkey started his career with Irish second-tier side Derry City, helping them earn promotion to the Irish top flight. Before he 2011 season, he signed for Southern Cross United in Australia. In 2014, he signed for Rochester Lancers in the United States. Before the 2015 season, Sharkey returned to Irish top flight club Derry City. Before the 2016 season, he signed for Limerick in the Irish second tier.
Before the 2017 season, he signed for Irish top flight team Sligo Rovers. Before the second half of 2018–19, Sharkey signed for Glenavon in the Northern Irish top flight, helping them win the 2019 Mid-Ulster Cup. In 2020, he signed for Northern Irish second",190033
73895322,https://en.wikipedia.org/wiki?curid=73895322,Jorge Russek,"and early 1970s, both in Mexican and American cinema. He appeared in American television series such as ""I Spy"" and ""The High Chaparral"", but he also landed roles in films such as ""The Wild Bunch"" (1969), ""Butch Cassidy and the Sundance Kid"" (1969), ""Soldier Blue"" (1970), ""Big Jake"" (1971), ""The Wrath of God"" (1972), and ""Pat Garrett and Billy the Kid"" (1973), all while remaining active in Mexico.
Russek won the Diosa de Plata for Best Actor in 1973 for his role in the film '. At the 18th Ariel Awards held in 1976, he won Best Actor for his role in '. Russek also won the Ariel Award for Best Supporting Actor at the 31st Ariel Awards in 1989 for his role in ""Los camaroneros"".
Russek earned his first",408667
