ID,URL,Title,Context,Index
73516546,https://en.wikipedia.org/wiki?curid=73516546,Samara Ortiz,"Samara Ortiz Cruz (born 16 July 1997) is a footballer who plays as a defender for Deportivo La Coruña.
Personal life.
Ortiz was born in Spain to a Cuban mother and a Spanish father. Her twin sister, Malena, is also a footballer. Outside of football, she studied for a degree in Environmental Science at the University of Alcalá.
Club career.
Ortiz started her career in Rayo Vallecano's academy along with her twin sister. The sisters both ended up playing for CD Canillas and then its successor CD Tacón, a club that would itself progress to become Real Madrid. In the summer of 2021, Samara Ortiz would join Danish club Brøndby meaning that the sisters were separated for the first time. After one season in Denmark, Ortiz opted to move back to Spain",347159
71165964,https://en.wikipedia.org/wiki?curid=71165964,Dominican College of Psychologists,"Interamerican Psychological Society, the ADOPSI held the XVIII Interamerican Congress of Psychology.
In the year 2000, the ADOPSI stopped its efforts as it was replaced by the Dominican College of Psychologists.
Law 22-01.
In 2001 the executive power of the Dominican Republic put into effect law No. 22-01 which created the legal basis for the College of Psychologists to be funded. This law states that:The Dominican College of Psychologists is invested with legal personality and its own assets for an undefined period of time. Its legal domicile will be located in the city of Santo Domingo, the capital of the Dominican Republic. It will function in conformity with the goals established by this law, the ethics, discipline, and the statutes of its code.The law also covers the requirements for the legal",17055
74331974,https://en.wikipedia.org/wiki?curid=74331974,List of sultans of Darfur,"This is a list of sultans of the Sultanate of Darfur.
List.
Names and dates taken from John Stewart's ""African States and Rulers"":
Sultans.
""Position abolished in 1874 after Darfur becomes a province of the Anglo-Egyptian Sudan"".
Governors of Darfur.
""Position of Sultan re-established in 1899 following decline of the Mahdists"".
Sultans.
""Position abolished in 1916 after Darfur again becomes a province of the Anglo-Egyptian Sudan"".",471521
73788648,https://en.wikipedia.org/wiki?curid=73788648,Alain Weber (artistic director),"Alain Weber is a French artistic director, musical advisor, producer and stage director. He is the artistic director of several festivals including, Sacred Spirit Festival of Jodhpur and Nagaur, the Fez World Sacred Music Festival, Les Orientales d'Anjou Festival in Saint-Florent le Vieil and Angers and the Al Kamandjati Festival. He is also the artistic director of Zaman Productions, which he set up in 2001 to promote artists and projects. Alain Weber is currently the world music advisor to the Philharmonie de Paris.
Career.
Weber began his career in the late 70s with the discovery of the music of Upper Egypt, where he decided to create, with the help of the Ministry of Culture (Egypt), the group, ""Musicians of the Nile"", one of the first traditional Arab music ensembles to",390517
72977646,https://en.wikipedia.org/wiki?curid=72977646,Mode conversion,"Mode conversion is the transformation of a wave at an interface into other wave types (modes).
Principle.
Mode conversion occurs when a wave encounters an interface between materials of different impedances and the incident angle is not normal to the interface. Thus, for example, if a longitudinal wave from a fluid (e.g., water or air) strikes a solid (e.g., steel plate), it is usually refracted and reflected as a function of the angle of incidence, but if some of the energy causes particle movement in the transverse direction, a second transverse wave is generated, which can also be refracted and reflected. Snellius' law of refraction can be formulated as:
formula_1
This means that the incident wave is split into two different wave types at the interface. If we consider a wave incident",258931
74569217,https://en.wikipedia.org/wiki?curid=74569217,Isenohama Keitarō,"of the Tatsunami-Isegahama ""ichimon"". His tomb is in the family vault at Hompō-ji temple, in the special district of Taitō, Tokyo.
His hobby was writing novels, which were published in magazines. He is said to have always carried manuscript papers in his kimono as well. He had his wife run the sumo teahouse Mikawaya, currently the tenth Sumo Information Centre at the Ryōgoku Kokugikan's ""annaijo"" entrance.
Fighting style.
He was short and light, but he was known for muscular body. Both he and his father were known for their monstrous strength, and there is a legend that they were able to spin a large bronze bell from Narita-san Temple with one hand. His preferred grip was ""hidari-yotsu"", a right hand outside, left hand inside position. Known for his ""uwatenage"", he surprised",512193
74518877,https://en.wikipedia.org/wiki?curid=74518877,1884 women's tennis season,"The 1884 Women's tennis season was a tennis circuit composed of 33 national, regional, county, and regular tournaments. The season began in March in Brooklyn, United States, and ended in December in Melbourne, Australia.
Season summary.
Prior to the creation of the International Lawn Tennis Federation and the establishment of its world championship events in 1913 the Wimbledon Championships, the U.S. National Championships, the Irish Lawn Tennis Championships and the Northern Championships were considered by players and historians as the four most important tennis tournaments to win.
1884 sees a slight expansion in the number women's singles events being held as the tennis circuit continues to grow. In March the 23rd Regiment Armory Indoors tournament is held at the 23rd Regiment Armory in Brooklyn is the first indoor wood court tournament",502252
71986645,https://en.wikipedia.org/wiki?curid=71986645,Our Lady of La Leche,"Our Lady of La Leche (Spanish: Nuestra Señora de La Leche y Buen Parto; ""Our Lady of the Milk and Good Delivery"") is a Catholic title of the Blessed Virgin Mary associated with a statue of her breastfeeding the infant Jesus Christ. It is said to be one of the oldest of all Marian devotions. 
Dating back to the Early Church, the image was later widely venerated by Spanish Catholics in the early modern era, some of whom brought the image and devotion to the New World and what would become the United States. 
History.
Our Lady of La Leche is an ancient devotion to the Blessed Virgin Mary dating back to the time of the Roman Empire, where Christians depicted the infant Jesus nursing at Mary's breast on",93192
74341338,https://en.wikipedia.org/wiki?curid=74341338,Iliad Media Group,"Alternative Rock
KSRV | 96.1 Bob FM, Adult Hits form the '80s, '90s, and 2000s
KSRV-HD2 | 99.9 Fox Sports Boise, Sports Talk
KWYD | Wild 101.1 FM, Rhythmic CHR
KZMG | My 102.7, Hot Adult Contemporary
Twin Falls
KIKX | 104.7 Bob FM, Adult Variety
KIRQ | Q106.7 FM, Hot Adult Contemporary
KTPZ | Music Monster 92.7 FM, Top 40
KYUN | 102.1 FM The Bull, Country
KYUN-HD2 | I-Rock 105.1 FM, Active Rock
KYUN-HD3 | Magic 95.1 FM, Oldies
External links.
Iliad Media Group
Iliad Sends Off Host Ken Bass on Radio Ink",473462
74711413,https://en.wikipedia.org/wiki?curid=74711413,1834 Indiana gubernatorial election,"election and the Nullifiers none at all.
Indiana Whigs did not hold a state convention ahead of the gubernatorial election. Noble was widely acknowledged as the favorite candidate of the Whigs but still saw benefit in maintaining the public appearance of nonpartisanship. His campaign was supported by the Whig partisan press alongside Lieutenant Governor David Wallace and the Whig legislative slate.
Democratic nomination.
Delegates from forty counties met at Indianapolis on December 9, 1833, to nominate a candidate for governor. The call for a state convention of Hoosier Jacksonians had been issued by the editor of the ""Indiana Democrat"", Alexander F. Morrison, who declared the ""paramount interests"" of the country demanded ""concert of action"" among loyal Jacksonians. Calling themselves the ""Democratic Republican"" convention, the gathering was the first of its kind",539034
68724660,https://en.wikipedia.org/wiki?curid=68724660,The Penguin (TV series),"Kelly had one day left of filming to complete before filming was shut down. Filming was expected to occur over five or six months.
Marketing.
The first footage from the series' production was revealed on April 12, 2023, during the Max Day press event. Anthony D'Alessandro of ""Deadline Hollywood"" said the footage had ""the look of a dark ""Sopranos"", with Farrell playing a full-on crime boss"", while Matt Patches at ""Polygon"" also highlighted the ""Sopranos"" energy and noted it continued to use the ""dark, orange-washed aesthetic"" from ""The Batman"". Ryan Scott of ""/Film"" said the teaser, which combined the series' footage with behind-the-scenes work, was ""shockingly put together"" given filming had only recently begun then and that it looked like a ""very gritty crime drama"". He also noted the teaser",7409
74268096,https://en.wikipedia.org/wiki?curid=74268096,Estates General of 1593,"awaiting his arrival, among them Mayenne's son and Cardinal Pellevé. Feria and Pellevé entered the Estates chamber, each taking a seat on opposite sides of a vacant throne that had been set up. He introduced himself with a speech in which he expounded on how España had supported France over the centuries. Unable to speak French the speech was delivered in Latin. This point was finished with the recent relief España had provided to the cities of Paris and Rouen during their respective sieges, and the vast sums of money Felipe had expended in support of the Catholic ""ligue"". This was too much for some in the Estates, and Cardinal Pellevé rose to expound upon the thousand year long services France had given to España all the way",463634
72381699,https://en.wikipedia.org/wiki?curid=72381699,List of leaders of the house in the Tamil Nadu Legislative Assembly,"The Leader of the House in the Tamil Nadu Legislative Assembly is an elected Member of Legislative Assembly who leads the ruling party in the Tamil Nadu Legislative Assembly. The Leader of the House in the Tamil Nadu Legislative Assembly is the chairperson of the legislative assembly's largest political party, which is part of the government of Tamil Nadu. A minister will be appointed by the government as the Leader of the House. Rules of Procedure provide that the Speaker of the legislative assembly shall consult the Leader of the House before allocating time for discussion of certain items of business. The arrangement of government business is his ultimate responsibility. His foremost duty is to assist the Speaker in the conduct of business.
Since 1952, the Tamil Nadu Legislative",160815
73644588,https://en.wikipedia.org/wiki?curid=73644588,A Colour Atlas of Urology,"A Colour Atlas of Urology is a book of urology images first published by Wolfe Medical Publications in 1983. It is co-authored by Reginald Wyndham Lloyd-Davies, James G. Gow and D. R. Davies. 1,188 Images include those of pathological specimens, photographs at endoscopy of the bladder and diagrams that explain urological diagnostic procedures. 70 images relate to lesions of the penis and scrotum. A second edition was published in 1994.
A review in the ""Postgraduate Medical Journal"" noted that the X-ray of lung metastases was back to front. Another review considered it a complete work covering everything a urologist could possibly see in their profession. The ""British Journal of Venereal Disease"" noted that the book was aimed at urologists but suggested that genitourinary physicians might be interested in it.",367793
73239888,https://en.wikipedia.org/wiki?curid=73239888,R Chamaeleontis,"R Chamaeleontis (abbreviated to R Cha), also known as HD 71793, is a Mira variable located in the southern circumpolar constellation Chamaeleon. It has an apparent magnitude that ranges from 7.5 to 14.1, which is below the limit for naked eye visibility. Gaia DR3 parallax measurements place it about 3,000 light years away and it is currently approaching with a heliocentric radial velocity of .
This star was first reported to be variable in 1906, the first to be discovered in the constellation of Chamaeleon.
R Cha has a stellar classification that has been recorded between M4e near maximum and M8e near minimum. It is an asymptotic giant branch star that has exhausted its core hydrogen and helium and is now fusing hydrogen and helium in separate shells outside its",299575
72001575,https://en.wikipedia.org/wiki?curid=72001575,Amie Donald,"really takes the creation from mildly creepy to terrifying... much of M3GAN's physicality came directly from Donald"". ""The Hollywood Reporter"" noted that Donald and co-star McGraw became close friends during the filming.
Personal life.
Donald lives in Auckland, New Zealand.",95058
73950032,https://en.wikipedia.org/wiki?curid=73950032,2004 Albany State Golden Rams football team,"The 2004 Albany State Golden Rams football team represented Albany State University as a member of the Southern Intercollegiate Athletic Conference (SIAC) during the 2004 NCAA Division II football season. Led by fifth-year head coach Mike White, the Golden Rams compiled an overall record of 11–1, with a conference record of 8–0, and finished as SIAC champion. At the conclusion of the season, Albany State were also recognized as black college national champion after they advanced to the NCAA Division II Quarterfinal and lost to Valdosta State.",418336
73871742,https://en.wikipedia.org/wiki?curid=73871742,Revolutionary 3rd Army,"The governors were more numerous among the sergeants. At the time of the coup the region was commanded by General Silvino Castor da Nóbrega, who ""if not openly preaching, in a veiled manner defended the President's positions"". Some of Silvino's subordinates considered him too close to the left, but others admired him as professional, disciplined and legalistic. The commander of the Divisionary Infantry (ID/5), Chrysantho de Miranda Figueiredo, openly defended the reforms proposed by the president.
Silvino and Chrysantho were on vacation in Rio de Janeiro. General Dario Coelho of the Divisionary Artillery (AD/5) was in interim command of the region. Colonels Rubens Barra and Reynaldo de Mello Almeida were responsible for ID/5 and AD/5. This was a disadvantage for the government: Dário sympathized with the conspirators. General Carlos",404574
71699141,https://en.wikipedia.org/wiki?curid=71699141,Christabel Russell,"for almost a year and on 15 October 1921 Christabel gave birth to a boy who was named Geoffrey. She wrote to her husband, adamant the child could only be his and hoping to restore the marriage, but Russell did not reply. The dress shop thrived, partly on account of curious customers but Christabel accepted her solicitors' advice not to be seen out alone with any man. The birth of her child affected her feelings: she wrote to her husband ""It is extraordinary how it changes ones outlook having a baby... I feel quite different"".
First divorce case.
The divorce trial commenced in July 1922 and was reported on in detail in the press. Russell's parents hired a very strong legal team including Sir John Simon and Douglas Hogg (later",46167
72112700,https://en.wikipedia.org/wiki?curid=72112700,List of places in the Northern Territory by population,"The Northern Territory is a self governing territory of Australia. It has a population of 232,605 as of the 2021 Australian census and occupies an area of . Official population statistics are published by the Australian Bureau of Statistics, which conducts a census every five years. The most recent census for which data has been released is the 2021 census.
Urban centres and localities by population.
SA1's are areas that subdivide all of Australia, and have a population between 200 and 800 people and an average population size of 400. Urban centres and localities are defined by the Australian Bureau of Statistics to be clusters of urban SA1's. Clusters with a population higher than 1,000 are considered urban centres and clusters with a population between 200 and 999 are considered",113270
72502277,https://en.wikipedia.org/wiki?curid=72502277,Drummuie,"Drummuie, formerly Golspie Technical School, is a municipal structure in Drummuie Terrace, Golspie, Highland, Scotland. The complex, which was the headquarters of Sutherland County Council and is currently used as council offices for The Highland Council, is a Category B listed building.
History.
The Drummuie estate has its origins in Drummuie House, which was commissioned by a veteran of the Napoleonic Wars, Captain Robert Sutherland, and was completed in 1809. In the early 20th century, Millicent Leveson-Gower, Duchess of Sutherland decided to commission a technical school for the education of the sons of local crofters. Her husband, Cromartie Sutherland-Leveson-Gower, 4th Duke of Sutherland donated the land; the major contributors to the cost of construction were The Duke of Sutherland and the American businessman, Andrew Carnegie. The site they selected was",180626
73888186,https://en.wikipedia.org/wiki?curid=73888186,Mormyrus cyaneus,"Mormyrus cyaneus is a species of electric fish in the family Mormyridae. It is native to the Democratic Republic of the Congo and can reach a size of approximately .
Regarding its conservation status, according to the IUCN, this species can be classified as ""vulnerable (VU)"".",407228
74502344,https://en.wikipedia.org/wiki?curid=74502344,Her Tale of Shim Chong,"in their 15 best romance manhwa, remarking that ""grabbing the reader's attention, the narrative and dialogue in this story are beautifully written, entangling the mysticism and historical contexts very poetically.""
The Comic Book Resources similarly included the series in their ""25 Top Manhwa You Need To Read"".",499136
74007243,https://en.wikipedia.org/wiki?curid=74007243,International University of Catalonia,"The International University of Catalonia (UIC Barcelona) is a private university in Barcelona, Spain, created in 1997 and recognized by the Parliament of Catalonia by Law 11/1997, of October 1. It is part of the Xarxa Vives d'Universitats. It has two campuses, one in Barcelona and the other one in Sant Cugat del Vallès.
Its ideology is based on Christian humanism and offers pastoral care in its Chaplaincy Service, in charge of the Prelature of Opus Dei.",428821
72814358,https://en.wikipedia.org/wiki?curid=72814358,Chicago and West Towns Bus Co.,"In 1923, the Illinois Commerce Commission ruled that the individual suburbs had no control over routes and the West Towns would now deal directly with the Illinois Commerce Commission. With the new Ill.C.C. ruling, the West Towns began applying for new routes, most with buses. They petitioned for ten new routes in 1923, eight more in 1925, and four more in 1926. From two buses in 1923, the West Towns went to 46 in 1930.
In 1929, the great depression caused net income to fall from $138,080 in 1929 to -$37,982 in 1931. The company went into bankruptcy and was reorganized as the ""Chicago and West Towns Railway Incorporated"". The company survived but continued to lose money all through the 1930s.
1935 showed a change to buses coming. In 1934,",233999
72597373,https://en.wikipedia.org/wiki?curid=72597373,Chris Tomlinson (politician),"in the general election.
In the legislature.
Tomlinson was sworn into the Maryland House of Delegates on January 11, 2023, with the start of the Maryland General Assembly's 445th legislative session. He is a member of the House Judiciary Committee.
Political positions.
Tomlinson supported President Donald Trump in the 2020 presidential election, attending a Trump rally in Hershey, Pennsylvania in December 2019.
During his 2022 House of Delegates campaign, Tomlinson said he planned to introduce legislation in the 2023 legislative session that would improve human resources practices in state government by requiring the fiscal notes of bills to include the number of new employees needed to accomplish the legislation's goals. He also said he supported legislation to limit the powers of the Maryland State Board of Education.",199037
73379921,https://en.wikipedia.org/wiki?curid=73379921,248th Rifle Division,"and five more days of local battles for position before 5th Shock went over to the defense on May 4.
Prior to a new effort to drive into Bessarabia General Malinovskii carried out an extensive regrouping of his Front. Among other measures the 248th was reassigned to the 34th Guards Rifle Corps, which also contained the 203rd and 243rd Rifle Divisions. The Corps was then shifted to the north of Grigoriopol, being in position by May 10. The Front's orders called for an ambitious operation in mid-May to eliminate a German bridgehead on the east bank of the Dniestr, then to cross the river and help encircle the enemy forces facing 8th Guards Army farther south. 34th Guards Corps had 23rd Tank Corps plus two artillery and two mortar",323444
74723082,https://en.wikipedia.org/wiki?curid=74723082,"List of Acts of the Parliament of Great Britain, 1725–1729","This is a complete list of Acts of the Parliament of Great Britain for the years 1725–1729. For Acts passed up until 1707 see List of Acts of the Parliament of England and List of Acts of the Parliament of Scotland. See also the List of Acts of the Parliament of Ireland to 1700 and the List of Acts of the Parliament of Ireland, 1701–1800.
For Acts passed from 1801 onwards see List of Acts of the Parliament of the United Kingdom. For Acts of the devolved parliaments and assemblies in the United Kingdom, see the List of Acts of the Scottish Parliament, the List of Acts of the Northern Ireland Assembly, and the List of Acts and Measures of Senedd Cymru; see also the List of Acts of",541113
71626126,https://en.wikipedia.org/wiki?curid=71626126,Electoral system of Hungary,"separating the upper table (Magnates) and the lower table (Delegates). The members of the upper table (which later became the House of Magnates) were the nobles and high priests, by birth or office. At the meetings of the lower table (which later became the House of Representatives), delegates selected by election represented the other orders.
Diet (1608–1848).
The election of the delegates of the lower table took place in the elections taking place in the noble counties (the county self-governing institution of the nobility) that emerged from the 13th century. About 10% of the entire population of voting age could vote for the elected delegates of the lower table (5% county nobility, 5% residents of free royal cities). Even within this, the number of representative seats was not proportional: from",33702
71916542,https://en.wikipedia.org/wiki?curid=71916542,Native American and Irish interactions,"Native American nations, Irish immigrants to the United States, and residents of Ireland have a history of often-supportive interactions dating back to the start of the Irish Potato Famine. Across multiple generations, people from both communities have drawn attention to their parallel histories of colonization by English-speaking countries. Scholarship on, and press attention to, these interactions has highlighted both acts of solidarity and the participation of some Irish immigrants in the invasion and dispossession of Native Americans.
First interactions.
Cooperation between the Irish and Native American Nations dates to at least the mid-19th century, a time of trauma in both regions. The Trail of Tears, the forced mass relocation of Native American tribes from the American Southeast to the Indian Territory (later known as Oklahoma), took place between 1830 and",81667
72681937,https://en.wikipedia.org/wiki?curid=72681937,Amira Abdelrasoul,"of Saskatchewan, Yeates School of Graduate Studies at the Toronto Metropolitan University, and the Kidney Health and Disease (M3K) Committee. In addition she is a member of  M3K Organizing Committee for the second pan-Canadian Molecules and Mechanisms Mediating Kidney Health and Disease (M3K) Meeting in Montreal, Canada, 2023.
Since 2018, Abdelrasoul has been a part of the Membrane Technology Design Projects Client at the University of Toronto for Engineering Strategies and Practice Course (ESP) APS112 and APS113. She joined ""Scientific Reports"" as an editorial board member in 2022.
Abdelrasoul also achieved a teaching portfolio with a University Teaching Development Professional Program (UTDP) accredited by SEDA (Staff and Educational Development Association) in the UK. She is a licensed Instructional Skills and Educational Development Facilitator and a Fellow of the Staff and",212080
73757700,https://en.wikipedia.org/wiki?curid=73757700,2023–24 Lowland Football League,"The 2023–24 Scottish Lowland Football League is the 11th season of the Lowland Football League, part of the fifth tier of the Scottish football pyramid system. The Spartans are the reigning champions but are unable to defend their title following their promotion to Scottish League Two.
Teams.
Albion Rovers became the fourth club to join the league via relegation from the SPFL, having lost the previous season's League Two play-off against The Spartans. East of Scotland League champions Linlithgow Rose were promoted to the league, replacing founding league member Dalbeattie Star who were relegated to the South of Scotland League.
Rangers B withdrew prior to the start of the season.
From Lowland League.
Promoted to League Two
Relegated to South of Scotland League
Withdrew
To Lowland League.
Relegated from League Two
Promoted from East of Scotland League
Stadia and",385629
