ID,URL,Title,Context,Index
71852483,https://en.wikipedia.org/wiki?curid=71852483,Konstantin Kornilov,"the journal ""Psychology"". From 1923 to 1930 he was director of the Institute of Psychology.
In 1930, during inspections and audits of the Institute of Experimental Psychology of the Russian Academy of Social Sciences, the commission of the Rabkrin revealed the inefficiency of the work of this scientific institution and the misappropriation of the allocated budget funds. As a result, in November 1930, Kornilov was dismissed from the leadership of the institute and the institute was fundamentally reorganized after Aron Zalkind was appointed director. Just a few months later, in the spring of 1931, in a reorganized and renamed institute under the leadership of Zalkind and with the active participation of Lev Vygotsky, Alexander Luria and others, a critical scientific discussion was held to discuss the theoretical provisions and",71239
71692961,https://en.wikipedia.org/wiki?curid=71692961,Miyuu Masuhara," is a Japanese ice hockey goaltender and member of the Japanese national team, currently playing with DK Peregrine in the Women's Japan Ice Hockey League (WJIHL) and All-Japan Women's Ice Hockey Championship.
Playing career.
As a junior player with the Japanese national under-18 team, she participated in the 2016 IIHF U18 Women's World Championship.
Masuhara was a part of the Japanese delegation at the 2022 Winter Olympics in Beijing. Selected as a reserve player for the women's ice hockey tournament, she did not dress for any games. 
She was Japan's starting goaltender at the 2022 IIHF Women's World Championship, where she maintained a steady 91.48 save percentage across six games and recorded a 61-shot shutout against in the fifth place game.
Masuhara won a silver medal with the Japanese team in",45010
73394029,https://en.wikipedia.org/wiki?curid=73394029,José Miñones,"Galician Isidro Parga Pondal program.
Political career.
He was elected in the 2007 Spanish local elections as councillor of the municipality of Ames (La Coruña) and during that legislature he was councillor for Administrative Reform, Administration Quality, New Technologies and Health. He was re-elected in the 2011 Spanish local elections and in 2012 he was appointed spokesperson of the Socialist Local Group. Re-elected again in 2015, he was appointed mayor of Ames after an agreement with minor political groups. He was elected for a second term as mayor in 2019.
He resigned in March 2021 after being appointed by prime minister Pedro Sánchez as delegate of the Government in the Galicia region.
Health minister.
On 27 March 2023, the Prime Minister announced his appointment as minister of Health, replacing Carolina Darias, who was",325802
73240021,https://en.wikipedia.org/wiki?curid=73240021,"Deep Creek, Idaho","Deep Creek is an unincorporated community in Twin Falls County, Idaho, United States, roughly west of Buhl. Deep Creek had a post office 1909–1913.
Deep Creek is part of the Twin Falls, Idaho Metropolitan Statistical Area.",299602
53408261,https://en.wikipedia.org/wiki?curid=53408261,Nancy M. Graham,"firm. Following a brief return to private life, Graham successfully campaigned for the city's 1991 mayoral election, the first direct election for that office in several decades.
Graham became the first strong mayor of West Palm Beach upon her inauguration on November 21, 1991. She is most often recognized for revitalizing downtown West Palm Beach, especially for improvements to Clematis Street and the construction of CityPlace (now known as The Square), which opened about a year after she left office in 1999. After again briefly returning to the private sector, she served a short stint on the city's Downtown Development Authority board. In 2005, she moved to San Diego to become executive director of Centre City Development Corporation, but a misdemeanor conflict of interest conviction resulted in her being fined",2224
71860691,https://en.wikipedia.org/wiki?curid=71860691,East European Film Bulletin,"East European Film Bulletin is a not-for-profit&lt;ref name=""societe/53748427100011""&gt;&lt;/ref&gt;&lt;ref name=""eefb/privacy""&gt;&lt;/ref&gt; online journal&lt;ref name=""zagrebdox/2018/fipresci_jury""&gt;&lt;/ref&gt;&lt;ref name=""film.elte.hu/laszlo-strausz""&gt;&lt;/ref&gt; dedicated to the criticism&lt;ref name=""uantwerpen/2022/Vuković""&gt;&lt;/ref&gt; of films related to Central, Eastern and South-Eastern Europe,&lt;ref name=""eefb/about""&gt;&lt;/ref&gt; published 10 times a year.&lt;ref name=""eefb/contact""&gt;&lt;/ref&gt;
History.
On 1 January 2011, in Paris, France, East European Film Bulletin was launched online. Co-founders and co-editors-in-chief are Konstanty Kuzma and Moritz Pfeifer.&lt;ref name=""mubi/cannes-2011-un-certain""&gt;&lt;/ref&gt;&lt;ref name=""fipresci/cottbus-2015""&gt;&lt;/ref&gt;&lt;ref name=""eefb/team""&gt;&lt;/ref&gt;&lt;ref name=""parisberlinmag/pfeifer""&gt;&lt;/ref&gt;",72658
72635217,https://en.wikipedia.org/wiki?curid=72635217,Coalition of Change for Unity,"The Coalition of Change for Unity () or Blue Sapphire Coalition () formerly Coalition of Change () is an upcoming political alliance in Indonesia which will be formed through agreement between three political parties, NasDem, PKS, and Demokrat, in the face 2024 Indonesian presidential election.
On 3 October 2022, Nasdem Party leader Surya Paloh officially declared Anies Baswedan as their presidential candidate for the 2024 Indonesian presidential election.
As of December 2022, Coalition of Change has not yet officially been formed from the three political parties, despite confirmations it was in the works, with current plans for formation set for January 2023.
On 24 March 2023, the coalition formally rebranded as the Coalition of Change for Unity and the coalition formally chartered by the three parties.",203924
